{
  "$defs": {
    "InstancePatch": {
      "additionalProperties": false,
      "properties": {
        "instance_id": {
          "pattern": "[A-Za-z0-9][A-Za-z0-9_.:-]{0,95}",
          "type": "string"
        },
        "parameters": {
          "items": {
            "$ref": "#/$defs/ParameterValue"
          },
          "maxItems": 64,
          "type": "array"
        },
        "schema_version": {
          "enum": [
            1
          ]
        }
      },
      "required": [
        "schema_version",
        "instance_id",
        "parameters"
      ],
      "type": "object"
    },
    "ParameterValue": {
      "additionalProperties": false,
      "properties": {
        "name": {
          "pattern": "[A-Za-z0-9][A-Za-z0-9_.:-]{0,95}",
          "type": "string"
        },
        "schema_version": {
          "enum": [
            1
          ]
        },
        "value": {
          "anyOf": [
            {
              "type": "number"
            },
            {
              "type": "integer"
            },
            {
              "items": {
                "anyOf": [
                  {
                    "type": "number"
                  },
                  {
                    "type": "integer"
                  }
                ]
              },
              "maxItems": 16,
              "minItems": 1,
              "type": "array"
            },
            {
              "type": "string"
            },
            {
              "type": "boolean"
            },
            {
              "type": "null"
            }
          ]
        }
      },
      "required": [
        "schema_version",
        "name",
        "value"
      ],
      "type": "object"
    },
    "RecipePatch": {
      "additionalProperties": false,
      "properties": {
        "base_revision": {
          "minimum": 0,
          "type": "integer"
        },
        "instance_changes": {
          "items": {
            "$ref": "#/$defs/InstancePatch"
          },
          "maxItems": 128,
          "minItems": 1,
          "type": "array"
        },
        "locked_goal_ids": {
          "items": {
            "pattern": "[A-Za-z0-9][A-Za-z0-9_.:-]{0,95}",
            "type": "string"
          },
          "maxItems": 128,
          "type": "array"
        },
        "recipe_id": {
          "pattern": "[A-Za-z0-9][A-Za-z0-9_.:-]{0,95}",
          "type": "string"
        },
        "schema_version": {
          "enum": [
            1
          ]
        }
      },
      "required": [
        "schema_version",
        "recipe_id",
        "base_revision",
        "instance_changes",
        "locked_goal_ids"
      ],
      "type": "object"
    }
  },
  "$id": "urn:avatar-animation:movement:v1:RecipePatch",
  "$ref": "#/$defs/RecipePatch",
  "$schema": "https://json-schema.org/draft/2020-12/schema"
}
